94,Congratulations! You're Also the DBA!,David Stokes,Y,N,2022-05-16 09:45:00,5.16.2022 10:30 AM,Database 101 for Developers,"Are you an accidental DBA? Suddenly find out that, in addition to your other duties, you have to keep the database humming along too? Well, this is the session for you! &nbsp;<br><br>In this talk, you'll learn the five things you HAVE TO DO to keep a database happy and healthy. &nbsp;Even if your enterprise needs a DBA only five minutes a week, there are certainly some things that you need to know before tackling a database task to keep data safe.",Classroom 201 M2,,,,,,,,,,,,,
95,A Survey of MySQL Indexes Types,David Stokes,Y,N,2022-05-16 13:30:00,5.16.2022 2:15 PM,Database 101 for Developers,Adding an index to a table is a popular way to try and speed up queries. But MySQL has several types of indexes and many options. &nbsp;Which is best for your need? Do you need to ignore indexes for hash joins? Can functional indexes help the optimizer plan for a better query? And how do you test an index's effectiveness? This session will detail what you need to know to configure the best possible index for the needs of your applications in a simple and concise fashion.,Classroom 201 M2,,,,,,,,,,,,,
96,Percona Monitoring and Management (PMM) for Novices,David Stokes,Y,N,2022-05-16 14:15:00,5.16.2022 3:00 PM,Database 101 for Developers,"Percona Monitoring and Management (PMM) is an open source database observability, monitoring, and management tool for MySQL, PostgreSQL, and MongoDB that simplify operations, optimize performance, and improve the security of your database services. <br>This session will cover the installation of PMM, how to register your databases with it, and how to use PMM to make your life simpler. This session with start at zero and make you a hero at monitoring your MySQL, PostgreSQL, and MongoDB databases.",Classroom 201 M2,,,,,,,,,,,,,
97,How To Ease Major MySQL Upgrades!,Arunjith Aravindan; Alison Savage,Y,N,2022-05-16 15:00:00,5.16.2022 3:45 PM,Database 101 for Developers,"For a variety of reasons, including new features, performance benefits, bug fixes, and so on, it is essential to upgrade MySQL to the most recent version. Databases with obsolete versions are vulnerable. Major version upgrades, on the other hand, can be problematic if they haven't been well tested with your application, as the procedure may break it, render it inoperable, or cause performance issues. The goal of this talk is to go over the details of how to make major MySQL upgrades easier!<br><br>",Classroom 201 M2,,,,,,,,,,,,,
98,Optimizing MySQL for I/O,Taras Onishchuk,Y,N,2022-05-16 09:00:00,5.16.2022 9:45 AM,Advanced Database Topics,Best practices for tuning MySQL and Linux in regards to I/O subsystem and analysis of I/O throughput.,Classroom 202 M2,,,,,,,,,,,,,
99,Troubleshooting MySQL From a MySQL Developer Perspective,Marcelo Altmann,Y,N,2022-05-16 09:45:00,5.16.2022 10:30 AM,Advanced Database Topics,"Working as a MySQL Developer as part of the Bugs committee exposes you to a variety of bugs, such as server crashes, memory leaks, wrong query results, internal thread deadlocks, and others. In this talk, I will cover some of the technics we utilize to troubleshoot MySQL when things are not working as expected.<br><br>Some of the topics covered include:<ul><li>Reproducible test cases</li><li>Git Bisect</li><li>Stack Traces</li><li>GDB</li><li>Record and Replay</li></ul>By the end of this session, attendees will grasp how to tackle analyses of when software is not working as expected.",Classroom 202 M2,,,,,,,,,,,,,